{
  "metadata": {
    "company": "Sample Company",
    "role": "Data Analyst",
    "convention": "sample-data-analyst-2026-05",
    "generated_at": "2026-05-02T19:00:00Z",
    "primary_language": "sql",
    "dialect_note": "Examples target Postgres-compatible SQL. Notes flag Presto/Trino divergences where relevant.",
    "empty_state_explanation": "This is the template smoke-test fixture. The real_questions tab includes one example sourced entry."
  },
  "topics": [
    {
      "id": "joins",
      "title": "Multi-Table Joins",
      "tier": "T1",
      "frequency_signal": "Every Glassdoor SQL screen for the role mentions at least one multi-table join problem. (Sample fixture; real run cites real URLs.)",
      "sources": ["https://example.com/sample-source"],
      "language_mode": "sql",
      "worked": [
        {
          "difficulty": "easy",
          "prompt": "Return each production with the total spend across all its payments. Sort by total spend descending. Business motivation: leadership needs a one-page overview of which productions are burning the most cash this fiscal month so we can prioritize close reviews.",
          "schemas": [
            {
              "table": "productions",
              "columns": ["production_id", "title", "tier"],
              "rows": [
                ["P101", "Tentpole A", "tentpole"],
                ["P102", "Mid-Budget B", "mid"],
                ["P103", "Micro C", "micro"]
              ]
            },
            {
              "table": "payments",
              "columns": ["payment_id", "production_id", "vendor_id", "amount_usd", "paid_on"],
              "rows": [
                ["PMT-001", "P101", "V001", 12500, "2026-04-12"],
                ["PMT-002", "P101", "V002", 8000, "2026-04-15"],
                ["PMT-003", "P102", "V001", 4500, "2026-04-22"]
              ]
            }
          ],
          "solution": "SELECT\n  p.production_id,\n  p.title,\n  SUM(pmt.amount_usd) AS total_spend\nFROM productions p\nJOIN payments pmt USING (production_id)\nGROUP BY p.production_id, p.title\nORDER BY total_spend DESC;",
          "walk": [
            "Joining productions to payments on production_id is the right move because every payment must be tied to a production for spend to count.",
            "Used INNER JOIN (just JOIN) here, not LEFT JOIN, because productions with zero payments would show as NULL totals and clutter a leadership view.",
            "USING (production_id) is shorthand for ON p.production_id = pmt.production_id when the column has the same name in both tables.",
            "SUM aggregates payment amounts per production after grouping; without GROUP BY this would error.",
            "GROUP BY needs every non-aggregated SELECT column. We include p.production_id and p.title to satisfy that.",
            "ORDER BY total_spend DESC puts the highest-burn productions on top, matching what leadership scans first.",
            "If we wanted to include zero-payment productions, the query becomes a LEFT JOIN with COALESCE(SUM(amount_usd), 0)."
          ],
          "self_explain_prompt": "Before moving on, explain in your own words why an INNER JOIN was the right default here and when you would switch to LEFT JOIN."
        },
        {
          "difficulty": "medium",
          "prompt": "For each production, return the top 3 vendors by total spend, with their rank. Tiebreak on vendor_id. Business motivation: vendor concentration risk reviews require a per-production view of who is taking the most money.",
          "schemas": [
            {
              "table": "productions",
              "columns": ["production_id", "title"],
              "rows": [["P101", "Tentpole A"], ["P102", "Mid-Budget B"]]
            },
            {
              "table": "payments",
              "columns": ["payment_id", "production_id", "vendor_id", "amount_usd"],
              "rows": [
                ["PMT-001", "P101", "V001", 12500],
                ["PMT-002", "P101", "V002", 8000],
                ["PMT-003", "P101", "V003", 7500],
                ["PMT-004", "P101", "V004", 5500]
              ]
            }
          ],
          "solution": "WITH per_vendor AS (\n  SELECT\n    production_id,\n    vendor_id,\n    SUM(amount_usd) AS total_spend\n  FROM payments\n  GROUP BY production_id, vendor_id\n),\nranked AS (\n  SELECT\n    production_id,\n    vendor_id,\n    total_spend,\n    ROW_NUMBER() OVER (\n      PARTITION BY production_id\n      ORDER BY total_spend DESC, vendor_id ASC\n    ) AS rk\n  FROM per_vendor\n)\nSELECT * FROM ranked WHERE rk <= 3;",
          "walk": [
            "Two-step CTE: first sum per vendor per production, then rank. Doing both in one query is possible but harder to read.",
            "ROW_NUMBER picked over RANK because we want exactly 3 rows per production even when totals tie. RANK would give 1, 1, 3 on a tie at the top.",
            "PARTITION BY production_id resets the ranking inside each production.",
            "ORDER BY total_spend DESC, vendor_id ASC: the second key is the tiebreak the prompt asked for.",
            "Filtering with rk <= 3 in the outer SELECT, not in the window function itself, because window functions can't be in WHERE.",
            "If the requirement was 'top 3 including ties' the answer would use DENSE_RANK and the row count per production could exceed 3."
          ]
        },
        {
          "difficulty": "hard",
          "prompt": "Return productions where, in any single fiscal month, a single vendor accounted for over 60% of that month's total spend on the production. Output the production, fiscal month, offending vendor, and their share. Business motivation: surface single-vendor concentration risk that current reports miss.",
          "schemas": [
            {
              "table": "payments",
              "columns": ["payment_id", "production_id", "vendor_id", "amount_usd", "paid_on"],
              "rows": [
                ["PMT-001", "P101", "V001", 12000, "2026-04-12"],
                ["PMT-002", "P101", "V002", 1000, "2026-04-15"],
                ["PMT-003", "P101", "V003", 7000, "2026-04-20"]
              ]
            }
          ],
          "solution": "WITH monthly_vendor AS (\n  SELECT\n    production_id,\n    DATE_TRUNC('month', paid_on) AS fiscal_month,\n    vendor_id,\n    SUM(amount_usd) AS vendor_spend\n  FROM payments\n  GROUP BY production_id, DATE_TRUNC('month', paid_on), vendor_id\n),\nmonthly_total AS (\n  SELECT\n    production_id,\n    fiscal_month,\n    SUM(vendor_spend) AS month_spend\n  FROM monthly_vendor\n  GROUP BY production_id, fiscal_month\n)\nSELECT\n  mv.production_id,\n  mv.fiscal_month,\n  mv.vendor_id,\n  ROUND(100.0 * mv.vendor_spend / mt.month_spend, 1) AS pct_share\nFROM monthly_vendor mv\nJOIN monthly_total mt USING (production_id, fiscal_month)\nWHERE mv.vendor_spend > 0.60 * mt.month_spend;",
          "walk": [
            "Two CTEs: spend per vendor per month, then total per month. Joining them gives the share.",
            "DATE_TRUNC('month', paid_on) buckets payments by fiscal month. Postgres syntax. In Presto/Trino it would be date_trunc('month', paid_on).",
            "Joining monthly_vendor to monthly_total on (production_id, fiscal_month) gives each vendor row the denominator it needs.",
            "Filter with mv.vendor_spend > 0.60 * mt.month_spend. Stating it as a multiplication avoids a divide-and-compare which can lose precision on integer types.",
            "ROUND to one decimal place for human-readable output; the comparison itself uses the unrounded values to avoid false negatives at the boundary.",
            "If thresholds vary by production tier, you'd join in productions with a CASE on tier; documented as the obvious next iteration."
          ]
        }
      ],
      "faded": [
        {
          "difficulty": "easy",
          "prompt": "Return each production with the total spend across all its payments. Sort by total spend descending.",
          "schemas": [
            {
              "table": "productions",
              "columns": ["production_id", "title"],
              "rows": [["P101", "Tentpole A"], ["P102", "Mid-Budget B"]]
            },
            {
              "table": "payments",
              "columns": ["payment_id", "production_id", "amount_usd"],
              "rows": [["PMT-001", "P101", 12500], ["PMT-002", "P101", 8000]]
            }
          ],
          "scaffold": "SELECT\n  p.production_id,\n  p.title,\n  _____(pmt.amount_usd) AS total_spend\nFROM productions p\n_____ JOIN payments pmt USING (_____)\nGROUP BY p.production_id, p.title\nORDER BY total_spend _____;",
          "solution": "SELECT\n  p.production_id,\n  p.title,\n  SUM(pmt.amount_usd) AS total_spend\nFROM productions p\nINNER JOIN payments pmt USING (production_id)\nGROUP BY p.production_id, p.title\nORDER BY total_spend DESC;",
          "walk": [
            "First blank is the aggregator. SUM, not COUNT, because we want dollars not row counts.",
            "Second blank is the join type. INNER (or just JOIN) drops productions with no payments.",
            "Third blank is the join column.",
            "Fourth blank is the sort direction. DESC because leadership scans top-down."
          ]
        },
        {
          "difficulty": "medium",
          "prompt": "For each production, return the top 3 vendors by total spend, with their rank. Tiebreak on vendor_id.",
          "schemas": [
            {
              "table": "payments",
              "columns": ["production_id", "vendor_id", "amount_usd"],
              "rows": [["P101", "V001", 12500], ["P101", "V002", 8000]]
            }
          ],